{
  "version": 1,
  "source": { "file": "업무목록.csv", "rowCount": 117 },
  "reviewStatus": "PENDING_REVIEW",
  "items": {
    "task-113": { "phase": "사전준비", "timing": { "type": "D_DAY", "value": -30, "label": "D-30" } },
    "task-0": { "phase": "사전준비", "timing": { "type": "D_DAY", "value": -30, "label": "D-30" } },
    "task-1": { "phase": "사전준비", "timing": { "type": "D_DAY", "value": -25, "label": "D-25" } },
    "task-2": { "phase": "사전준비", "timing": { "type": "D_DAY", "value": -25, "label": "D-25" } },
    "task-3": { "phase": "사전준비", "timing": { "type": "D_DAY", "value": -20, "label": "D-20" } },
    "task-111": { "phase": "사전준비", "timing": { "type": "D_DAY", "value": -20, "label": "D-20" } },
    "task-112": { "phase": "사전준비", "timing": { "type": "D_DAY", "value": -20, "label": "D-20" } },
    "task-4": { "phase": "사전준비", "timing": { "type": "D_DAY", "value": -7, "label": "D-7" } },
    "task-5": { "phase": "사전준비", "timing": { "type": "D_DAY", "value": -7, "label": "D-7" } },
    "task-6": { "phase": "사전준비", "timing": { "type": "D_DAY", "value": -7, "label": "D-7" } },
    "task-7": { "phase": "사전준비", "timing": { "type": "D_DAY", "value": -7, "label": "D-7" } },
    "task-8": { "phase": "사전준비", "timing": { "type": "D_DAY", "value": -7, "label": "D-7" } },
    "task-98": { "phase": "사전준비", "timing": { "type": "D_DAY", "value": -7, "label": "D-7" } },
    "task-99": { "phase": "사전준비", "timing": { "type": "D_DAY", "value": -7, "label": "D-7" } },
    "task-100": { "phase": "사전준비", "timing": { "type": "D_DAY", "value": -7, "label": "D-7" } },
    "task-10": { "phase": "사전준비", "timing": { "type": "D_DAY", "value": -3, "label": "D-3" } },
    "task-11": { "phase": "사전준비", "timing": { "type": "D_DAY", "value": -3, "label": "D-3" } },
    "task-12": { "phase": "사전준비", "timing": { "type": "D_DAY", "value": -3, "label": "D-3" } },
    "task-13": { "phase": "사전준비", "timing": { "type": "D_DAY", "value": -3, "label": "D-3" } },
    "task-14": { "phase": "사전준비", "timing": { "type": "D_DAY", "value": -3, "label": "D-3" } },
    "task-15": { "phase": "사전준비", "timing": { "type": "D_DAY", "value": -3, "label": "D-3" } },
    "task-16": { "phase": "사전준비", "timing": { "type": "D_DAY", "value": -3, "label": "D-3" } },
    "task-9": { "phase": "사전준비", "timing": { "type": "D_DAY", "value": -3, "label": "D-3" } },
    "task-23": { "phase": "교육운영", "timing": { "type": "TRAINING_DAY", "value": 1, "label": "교육 1일차" } },
    "task-24": { "phase": "교육운영", "timing": { "type": "TRAINING_DAY", "value": 1, "label": "교육 1일차" } },
    "task-25": { "phase": "교육운영", "timing": { "type": "TRAINING_DAY", "value": 1, "label": "교육 1일차" } },
    "task-26": { "phase": "교육운영", "timing": { "type": "TRAINING_DAY", "value": 1, "label": "교육 1일차" } },
    "task-27": { "phase": "교육운영", "timing": { "type": "TRAINING_DAY", "value": 1, "label": "교육 1일차" } },
    "task-28": { "phase": "교육운영", "timing": { "type": "TRAINING_DAY", "value": 1, "label": "교육 1일차" } },
    "task-29": { "phase": "교육운영", "timing": { "type": "TRAINING_DAY", "value": 1, "label": "교육 1일차" } },
    "task-30": { "phase": "교육운영", "timing": { "type": "TRAINING_DAY", "value": 1, "label": "교육 1일차" } },
    "task-31": { "phase": "교육운영", "timing": { "type": "TRAINING_DAY", "value": 1, "label": "교육 1일차" } },
    "task-32": { "phase": "교육운영", "timing": { "type": "TRAINING_DAY", "value": 1, "label": "교육 1일차" } },
    "task-33": { "phase": "교육운영", "timing": { "type": "TRAINING_DAY", "value": 1, "label": "교육 1일차" } },
    "task-34": { "phase": "교육운영", "timing": { "type": "TRAINING_DAY", "value": 1, "label": "교육 1일차" } },
    "task-35": { "phase": "교육운영", "timing": { "type": "TRAINING_DAY", "value": 1, "label": "교육 1일차" } },
    "task-36": { "phase": "교육운영", "timing": { "type": "TRAINING_DAY", "value": 1, "label": "교육 1일차" } },
    "task-101": { "phase": "교육운영", "timing": { "type": "TRAINING_DAY", "value": 1, "label": "교육 1일차" } },
    "task-114": { "phase": "교육운영", "timing": { "type": "TRAINING_DAY", "value": 1, "label": "교육 1일차" } },
    "task-37": { "phase": "교육운영", "timing": { "type": "TRAINING_DAY", "value": 2, "label": "교육 2일차" } },
    "task-38": { "phase": "교육운영", "timing": { "type": "TRAINING_DAY", "value": 2, "label": "교육 2일차" }, "conditional": true },
    "task-39": { "phase": "교육운영", "timing": { "type": "TRAINING_DAY", "value": 2, "label": "교육 2일차" } },
    "task-40": { "phase": "교육운영", "timing": { "type": "TRAINING_DAY", "value": 2, "label": "교육 2일차" } },
    "task-41": { "phase": "교육운영", "timing": { "type": "TRAINING_DAY", "value": 2, "label": "교육 2일차" } },
    "task-102": { "phase": "교육운영", "timing": { "type": "TRAINING_DAY", "value": 2, "label": "교육 2일차" } },
    "task-115": { "phase": "교육운영", "timing": { "type": "TRAINING_DAY", "value": 2, "label": "교육 2일차" } },
    "task-42": { "phase": "교육운영", "timing": { "type": "TRAINING_DAY", "value": 3, "label": "교육 3일차" } },
    "task-43": { "phase": "교육운영", "timing": { "type": "TRAINING_DAY", "value": 3, "label": "교육 3일차" } },
    "task-44": { "phase": "교육운영", "timing": { "type": "TRAINING_DAY", "value": 3, "label": "교육 3일차" } },
    "task-45": { "phase": "교육운영", "timing": { "type": "TRAINING_DAY", "value": 3, "label": "교육 3일차" } },
    "task-46": { "phase": "교육운영", "timing": { "type": "TRAINING_DAY", "value": 3, "label": "교육 3일차" } },
    "task-103": { "phase": "교육운영", "timing": { "type": "TRAINING_DAY", "value": 3, "label": "교육 3일차" } },
    "task-116": { "phase": "교육운영", "timing": { "type": "TRAINING_DAY", "value": 3, "label": "교육 3일차" } },
    "task-47": { "phase": "교육운영", "timing": { "type": "TRAINING_DAY", "value": 4, "label": "교육 4일차" } },
    "task-48": { "phase": "교육운영", "timing": { "type": "TRAINING_DAY", "value": 4, "label": "교육 4일차" } },
    "task-49": { "phase": "교육운영", "timing": { "type": "TRAINING_DAY", "value": 4, "label": "교육 4일차" } },
    "task-50": { "phase": "교육운영", "timing": { "type": "TRAINING_DAY", "value": 4, "label": "교육 4일차" } },
    "task-51": { "phase": "교육운영", "timing": { "type": "TRAINING_DAY", "value": 4, "label": "교육 4일차" } },
    "task-104": { "phase": "교육운영", "timing": { "type": "TRAINING_DAY", "value": 4, "label": "교육 4일차" } },
    "task-117": { "phase": "교육운영", "timing": { "type": "TRAINING_DAY", "value": 4, "label": "교육 4일차" } },
    "task-52": { "phase": "교육운영", "timing": { "type": "TRAINING_DAY", "value": 5, "label": "교육 5일차" } },
    "task-53": { "phase": "교육운영", "timing": { "type": "TRAINING_DAY", "value": 5, "label": "교육 5일차" } },
    "task-54": { "phase": "교육운영", "timing": { "type": "TRAINING_DAY", "value": 5, "label": "교육 5일차" } },
    "task-55": { "phase": "교육운영", "timing": { "type": "TRAINING_DAY", "value": 5, "label": "교육 5일차" } },
    "task-56": { "phase": "교육운영", "timing": { "type": "TRAINING_DAY", "value": 5, "label": "교육 5일차" } },
    "task-57": { "phase": "교육운영", "timing": { "type": "TRAINING_DAY", "value": 5, "label": "교육 5일차" } },
    "task-58": { "phase": "교육운영", "timing": { "type": "TRAINING_DAY", "value": 5, "label": "교육 5일차" } },
    "task-59": { "phase": "교육운영", "timing": { "type": "TRAINING_DAY", "value": 5, "label": "교육 5일차" } },
    "task-60": { "phase": "정산", "timing": { "type": "TRAINING_DAY", "value": 5, "label": "교육 5일차" }, "riskLevel": "HIGH", "budget": { "related": true, "category": "교육운영비" } },
    "task-105": { "phase": "교육운영", "timing": { "type": "TRAINING_DAY", "value": 5, "label": "교육 5일차" } },
    "task-118": { "phase": "교육운영", "timing": { "type": "TRAINING_DAY", "value": 5, "label": "교육 5일차" } },
    "task-61": { "phase": "교육운영", "timing": { "type": "TRAINING_DAY", "value": 6, "label": "교육 6일차" } },
    "task-62": { "phase": "교육운영", "timing": { "type": "TRAINING_DAY", "value": 6, "label": "교육 6일차" } },
    "task-63": { "phase": "교육운영", "timing": { "type": "TRAINING_DAY", "value": 6, "label": "교육 6일차" } },
    "task-64": { "phase": "교육운영", "timing": { "type": "TRAINING_DAY", "value": 6, "label": "교육 6일차" } },
    "task-106": { "phase": "교육운영", "timing": { "type": "TRAINING_DAY", "value": 6, "label": "교육 6일차" } },
    "task-119": { "phase": "교육운영", "timing": { "type": "TRAINING_DAY", "value": 6, "label": "교육 6일차" } },
    "task-65": { "phase": "교육운영", "timing": { "type": "TRAINING_DAY", "value": 7, "label": "교육 7일차" } },
    "task-66": { "phase": "교육운영", "timing": { "type": "TRAINING_DAY", "value": 7, "label": "교육 7일차" }, "conditional": true },
    "task-67": { "phase": "교육운영", "timing": { "type": "TRAINING_DAY", "value": 7, "label": "교육 7일차" } },
    "task-68": { "phase": "교육운영", "timing": { "type": "TRAINING_DAY", "value": 7, "label": "교육 7일차" } },
    "task-69": { "phase": "교육운영", "timing": { "type": "TRAINING_DAY", "value": 7, "label": "교육 7일차" } },
    "task-107": { "phase": "교육운영", "timing": { "type": "TRAINING_DAY", "value": 7, "label": "교육 7일차" } },
    "task-120": { "phase": "교육운영", "timing": { "type": "TRAINING_DAY", "value": 7, "label": "교육 7일차" } },
    "task-70": { "phase": "교육운영", "timing": { "type": "TRAINING_DAY", "value": 8, "label": "교육 8일차" } },
    "task-71": { "phase": "교육운영", "timing": { "type": "TRAINING_DAY", "value": 8, "label": "교육 8일차" } },
    "task-72": { "phase": "교육운영", "timing": { "type": "TRAINING_DAY", "value": 8, "label": "교육 8일차" } },
    "task-73": { "phase": "교육운영", "timing": { "type": "TRAINING_DAY", "value": 8, "label": "교육 8일차" }, "riskLevel": "HIGH", "budget": { "related": true, "category": "교육운영비" } },
    "task-74": { "phase": "교육운영", "timing": { "type": "TRAINING_DAY", "value": 8, "label": "교육 8일차" }, "riskLevel": "HIGH" },
    "task-75": { "phase": "교육운영", "timing": { "type": "TRAINING_DAY", "value": 8, "label": "교육 8일차" } },
    "task-76": { "phase": "교육운영", "timing": { "type": "TRAINING_DAY", "value": 8, "label": "교육 8일차" } },
    "task-77": { "phase": "교육운영", "timing": { "type": "TRAINING_DAY", "value": 8, "label": "교육 8일차" }, "riskLevel": "HIGH", "budget": { "related": true, "category": "교육운영비" } },
    "task-78": { "phase": "교육운영", "timing": { "type": "TRAINING_DAY", "value": 8, "label": "교육 8일차" } },